{
  "contract_id": "AK-MDOS-V7",
  "package_version": "7.1.0-rc.1",
  "registry_id": "MDOS-V7-REQUIREMENTS",
  "registry_version": "1.0.0",
  "requirements": [
    {
      "acceptance_ids": [
        "AT-SRC7-01",
        "AT-SRC7-02",
        "AT-SRC7-03",
        "AT-SRC7-04",
        "AT-SRC7-05",
        "AT-SRC7-06",
        "AT-SRC7-07",
        "AT-SRC7-08",
        "AT-SRC7-09",
        "AT-SRC7-10"
      ],
      "applicable_tiers": [
        "G2",
        "PRODUCTION"
      ],
      "code_bindings": [],
      "criticality": "P2",
      "design_bindings": [
        "DESIGN:docs/market_demand_os_v7/APP-MDOS-SOURCE-PORTFOLIO.md#L101"
      ],
      "document": "docs/market_demand_os_v7/APP-MDOS-SOURCE-PORTFOLIO.md",
      "evidence_refs": [],
      "id": "MDOS-ADP-001",
      "line": 101,
      "owner_role": "SourceAuthority",
      "status": "DESIGNED",
      "test_bindings": [],
      "text_sha256": "529187efdf38be273a4fc17fda751a49f8f58829c020f1a3aee98e6f45c1e0ce"
    },
    {
      "acceptance_ids": [
        "AT-SRC7-01",
        "AT-SRC7-02",
        "AT-SRC7-03",
        "AT-SRC7-04",
        "AT-SRC7-05",
        "AT-SRC7-06",
        "AT-SRC7-07",
        "AT-SRC7-08",
        "AT-SRC7-09",
        "AT-SRC7-10"
      ],
      "applicable_tiers": [
        "G2",
        "PRODUCTION"
      ],
      "code_bindings": [],
      "criticality": "P2",
      "design_bindings": [
        "DESIGN:docs/market_demand_os_v7/APP-MDOS-SOURCE-PORTFOLIO.md#L106"
      ],
      "document": "docs/market_demand_os_v7/APP-MDOS-SOURCE-PORTFOLIO.md",
      "evidence_refs": [],
      "id": "MDOS-ADP-002",
      "line": 106,
      "owner_role": "SourceAuthority",
      "status": "DESIGNED",
      "test_bindings": [],
      "text_sha256": "d39e96a9717445a32e0f3366ee77335a315eac1edf6f84e2562cdbca7014f9ea"
    },
    {
      "acceptance_ids": [
        "AT-SRC7-01",
        "AT-SRC7-02",
        "AT-SRC7-03",
        "AT-SRC7-04",
        "AT-SRC7-05",
        "AT-SRC7-06",
        "AT-SRC7-07",
        "AT-SRC7-08",
        "AT-SRC7-09",
        "AT-SRC7-10"
      ],
      "applicable_tiers": [
        "G2",
        "PRODUCTION"
      ],
      "code_bindings": [],
      "criticality": "P2",
      "design_bindings": [
        "DESIGN:docs/market_demand_os_v7/APP-MDOS-SOURCE-PORTFOLIO.md#L110"
      ],
      "document": "docs/market_demand_os_v7/APP-MDOS-SOURCE-PORTFOLIO.md",
      "evidence_refs": [],
      "id": "MDOS-ADP-003",
      "line": 110,
      "owner_role": "SourceAuthority",
      "status": "DESIGNED",
      "test_bindings": [],
      "text_sha256": "c373b77e7b0074ac9bcdf05bcee7d4095d70a29e3e1806d928ae7a54945fa453"
    },
    {
      "acceptance_ids": [
        "AT-SRC7-01",
        "AT-SRC7-02",
        "AT-SRC7-03",
        "AT-SRC7-04",
        "AT-SRC7-05",
        "AT-SRC7-06",
        "AT-SRC7-07",
        "AT-SRC7-08",
        "AT-SRC7-09",
        "AT-SRC7-10"
      ],
      "applicable_tiers": [
        "G2",
        "PRODUCTION"
      ],
      "code_bindings": [],
      "criticality": "P2",
      "design_bindings": [
        "DESIGN:docs/market_demand_os_v7/APP-MDOS-SOURCE-PORTFOLIO.md#L114"
      ],
      "document": "docs/market_demand_os_v7/APP-MDOS-SOURCE-PORTFOLIO.md",
      "evidence_refs": [],
      "id": "MDOS-ADP-004",
      "line": 114,
      "owner_role": "SourceAuthority",
      "status": "DESIGNED",
      "test_bindings": [],
      "text_sha256": "386995372d0adb5927305e05054a81663fc809e7317647e3447c91d77833960f"
    },
    {
      "acceptance_ids": [
        "AT-ARC-01",
        "AT-ARC-02",
        "AT-ARC-03",
        "AT-ARC-04",
        "AT-ARC-05",
        "AT-ARC-06",
        "AT-ARC-07",
        "AT-ARC-08",
        "AT-ARC-09",
        "AT-ARC-10",
        "AT-ARC-11",
        "AT-ARC-12",
        "AT-ARC-13",
        "AT-ARC-14",
        "AT-ARC-15"
      ],
      "applicable_tiers": [
        "G2",
        "PRODUCTION"
      ],
      "code_bindings": [],
      "criticality": "P2",
      "design_bindings": [
        "DESIGN:docs/market_demand_os_v7/APP-MDOS-REFERENCE-ARCHITECTURE.md#L37"
      ],
      "document": "docs/market_demand_os_v7/APP-MDOS-REFERENCE-ARCHITECTURE.md",
      "evidence_refs": [],
      "id": "MDOS-ARC-001",
      "line": 37,
      "owner_role": "PlatformOwner",
      "status": "DESIGNED",
      "test_bindings": [],
      "text_sha256": "73c942e7dd4df5c74fc879bad2c299735e7710ca9f4a1a944db8b8c7151e490f"
    },
    {
      "acceptance_ids": [
        "AT-ARC-01",
        "AT-ARC-02",
        "AT-ARC-03",
        "AT-ARC-04",
        "AT-ARC-05",
        "AT-ARC-06",
        "AT-ARC-07",
        "AT-ARC-08",
        "AT-ARC-09",
        "AT-ARC-10",
        "AT-ARC-11",
        "AT-ARC-12",
        "AT-ARC-13",
        "AT-ARC-14",
        "AT-ARC-15"
      ],
      "applicable_tiers": [
        "G2",
        "PRODUCTION"
      ],
      "code_bindings": [],
      "criticality": "P2",
      "design_bindings": [
        "DESIGN:docs/market_demand_os_v7/APP-MDOS-REFERENCE-ARCHITECTURE.md#L41"
      ],
      "document": "docs/market_demand_os_v7/APP-MDOS-REFERENCE-ARCHITECTURE.md",
      "evidence_refs": [],
      "id": "MDOS-ARC-002",
      "line": 41,
      "owner_role": "PlatformOwner",
      "status": "DESIGNED",
      "test_bindings": [],
      "text_sha256": "2606a8a5a38359188bb74a91fa3a8b9b66dd63f029e022cf73e8cb6a7766dbdc"
    },
    {
      "acceptance_ids": [
        "AT-ASR-01",
        "AT-ASR-02",
        "AT-ASR-03",
        "AT-ASR-04",
        "AT-ASR-05",
        "AT-ASR-06",
        "AT-ASR-07",
        "AT-ASR-08",
        "AT-ASR-09",
        "AT-ASR-10",
        "AT-ASR-11",
        "AT-ASR-12",
        "AT-ASR-13",
        "AT-ASR-14"
      ],
      "applicable_tiers": [
        "G0",
        "G1",
        "G2",
        "PRODUCTION"
      ],
      "code_bindings": [],
      "criticality": "P0",
      "design_bindings": [
        "DESIGN:docs/market_demand_os_v7/APP-MDOS-DELIVERY-ASSURANCE.md#L8"
      ],
      "document": "docs/market_demand_os_v7/APP-MDOS-DELIVERY-ASSURANCE.md",
      "evidence_refs": [],
      "id": "MDOS-ASR-001",
      "line": 8,
      "owner_role": "AssuranceOwner",
      "status": "DESIGNED",
      "test_bindings": [],
      "text_sha256": "34b5e15394551f69b0c5eb21cdbc6400e38882df3b4614baf47e0d83e5fd4445"
    },
    {
      "acceptance_ids": [
        "AT-ASR-01",
        "AT-ASR-02",
        "AT-ASR-03",
        "AT-ASR-04",
        "AT-ASR-05",
        "AT-ASR-06",
        "AT-ASR-07",
        "AT-ASR-08",
        "AT-ASR-09",
        "AT-ASR-10",
        "AT-ASR-11",
        "AT-ASR-12",
        "AT-ASR-13",
        "AT-ASR-14"
      ],
      "applicable_tiers": [
        "G0",
        "G1",
        "G2",
        "PRODUCTION"
      ],
      "code_bindings": [],
      "criticality": "P0",
      "design_bindings": [
        "DESIGN:docs/market_demand_os_v7/APP-MDOS-DELIVERY-ASSURANCE.md#L13"
      ],
      "document": "docs/market_demand_os_v7/APP-MDOS-DELIVERY-ASSURANCE.md",
      "evidence_refs": [],
      "id": "MDOS-ASR-002",
      "line": 13,
      "owner_role": "AssuranceOwner",
      "status": "DESIGNED",
      "test_bindings": [],
      "text_sha256": "36eb9951c033a0f7904096e0ee3ce78ba07ad509da28e8f2ed772ea741b0b1f5"
    },
    {
      "acceptance_ids": [
        "AT-ASR-01",
        "AT-ASR-02",
        "AT-ASR-03",
        "AT-ASR-04",
        "AT-ASR-05",
        "AT-ASR-06",
        "AT-ASR-07",
        "AT-ASR-08",
        "AT-ASR-09",
        "AT-ASR-10",
        "AT-ASR-11",
        "AT-ASR-12",
        "AT-ASR-13",
        "AT-ASR-14"
      ],
      "applicable_tiers": [
        "G0",
        "G1",
        "G2",
        "PRODUCTION"
      ],
      "code_bindings": [],
      "criticality": "P0",
      "design_bindings": [
        "DESIGN:docs/market_demand_os_v7/APP-MDOS-DELIVERY-ASSURANCE.md#L18"
      ],
      "document": "docs/market_demand_os_v7/APP-MDOS-DELIVERY-ASSURANCE.md",
      "evidence_refs": [],
      "id": "MDOS-ASR-003",
      "line": 18,
      "owner_role": "AssuranceOwner",
      "status": "DESIGNED",
      "test_bindings": [],
      "text_sha256": "e2cde54b588d3676b5c677fffdb734070ce67522bfb7ecac2ba7637d9e8b116f"
    },
    {
      "acceptance_ids": [
        "AT-ASR-01",
        "AT-ASR-02",
        "AT-ASR-03",
        "AT-ASR-04",
        "AT-ASR-05",
        "AT-ASR-06",
        "AT-ASR-07",
        "AT-ASR-08",
        "AT-ASR-09",
        "AT-ASR-10",
        "AT-ASR-11",
        "AT-ASR-12",
        "AT-ASR-13",
        "AT-ASR-14"
      ],
      "applicable_tiers": [
        "G0",
        "G1",
        "G2",
        "PRODUCTION"
      ],
      "code_bindings": [],
      "criticality": "P0",
      "design_bindings": [
        "DESIGN:docs/market_demand_os_v7/APP-MDOS-DELIVERY-ASSURANCE.md#L22"
      ],
      "document": "docs/market_demand_os_v7/APP-MDOS-DELIVERY-ASSURANCE.md",
      "evidence_refs": [],
      "id": "MDOS-ASR-004",
      "line": 22,
      "owner_role": "AssuranceOwner",
      "status": "DESIGNED",
      "test_bindings": [],
      "text_sha256": "fe20546b3fea33405fa26ca39b22462363b63da7b525cc9f710d3ef2f1cd2ac8"
    },
    {
      "acceptance_ids": [
        "AT-ARC-01",
        "AT-ARC-02",
        "AT-ARC-03",
        "AT-ARC-04",
        "AT-ARC-05",
        "AT-ARC-06",
        "AT-ARC-07",
        "AT-ARC-08",
        "AT-ARC-09",
        "AT-ARC-10",
        "AT-ARC-11",
        "AT-ARC-12",
        "AT-ARC-13",
        "AT-ARC-14",
        "AT-ARC-15"
      ],
      "applicable_tiers": [
        "G2",
        "PRODUCTION"
      ],
      "code_bindings": [],
      "criticality": "P2",